par_id,category,pcl_score,text
4046,hopeless,3,We also know that they can benefit by receiving counseling from someone who can help them understand that their feelings are normal and that their situation is not hopeless ; someone who can help them put their situation in perspective and help them communicate with others who could provide support ; someone knowledgeable about resources they can access ; someone who can help them plan for their needs and the needs of their child by developing either a parenting plan or an adoption plan .
8330,refugee,2,"Many refugees do n't want to be resettled anywhere , let alone in the US ."
432,refugee,2,"He depicts demonstrations by refugees at the border post , their catastrophic living conditions and the desperate attempt of several hundred to cross a river a few kilometres from the camp to get into Macedonia on 14 March 2016 ."
2001,poor-families,2,t is remiss not to mention here that not all scavenging children come from poor families . Children hailing from affluent families use dumpsites as playgrounds .
773,immigrant,3,"Sheepherding in America has always been an immigrant 's job , too dirty , too cold and too lonely for anyone with options ."
7394,women,2,"KARACHI - On the eve of International Women 's Day , Pakistan People 's Party Chairman Bilawal Bhutto Zardari has announced that his party 's Women Wing will organise Karwan-e-Benazir rallies in all the provincial capitals and in Azad Jammu &amp; Kashmir , Gilgit-Baltistan and Fata to celebrate the day and PPP 's achievements for empowerment of women in the country ."
1572,migrant,4,If only we had more stories that championed the brilliance of migrant workers perhaps we 'd be able to challenge the silence that permits them to be treated in such a disdainful way .
5996,poor-families,3,Real poverty of Britain : Shocking images of UK in the Sixties where poor really meant poor <h> THESE hard-hitting photographs offer a glimpse into the harrowing day-to-day for poor families living in Britain during the Sixties .
6189,women,4,"""Our country is in need of serious change . We can continue to celebrate women 's day , throw massive budgets at events , give out goody bags with a cute lipsticks and celebrate female achievers once a year . This is without taking away from exceptional women who truly are making inroads into their environments but we are not just a cute lipstick , or pair of shoes , we are not just pretty and soft and squishy . We are not just child bearers , and there for procreation . So , why are we as women , so accepting of the placating and mollification thrown at us and overlook the inequalities through acceptance . I am by no means militant , but often , as even in politics , focus is shifted on true issues by drawing public attention to other """" things """" in order for us to be distracted . By shifting our focus from relevant issues we forget why we were disgruntled and angry and nothing ever changes ."""
6234,poor-families,2,"The World Health Organization did not give a reason for the increase in deaths , but a provincial health official in Sindh said that the disease hit areas where poor families did not vaccinate their children ."
10326,poor-families,2,"A top health official said today that the government could consider subsidies to help poor families pay for healthy food -- or imposing taxes on unhealthy products -- if other efforts fail to encourage better eating habits among Hong Kong residents . Dr Regina Ching from the Health Department said such moves could be explored as a way to cut levels of chronic illnesses in the city , such ..."
5248,women,3,"Maida noted that political issues should not twist women away from matters of development , the important thing is peace , and women must wake up , since they need economic revolution through peaceful means ."
9587,hopeless,4,Jamaicans are deemed to be among the most violent persons on planet Earth . Some argue that it has to do with our legacy of slavery which in itself was an act of extreme violence . Some even posit that it may well be that we have too much sugar in our blood ; while others point to the socio-economic conditions that the majority of black Jamaicans have to live under which have led them to a point of hopelessness and anger .
8706,poor-families,3,"A massive cleanup and awareness drive was conducted jointly by the LWMC and the Bahria University , Lahore Campus in different localities of Johar Town . The purpose of the drive was to improve state of cleanliness and sensitise poor families to hygienic conditions ."
7918,poor-families,3,""""""" Nigeria 's tertiary education system is still elitist . We do n't make allowance for poor families , families that have not yet produced a university graduate . How do these people assess the university education ?"""
9998,in-need,3,""""""" In addition , the Members of Parliament will visit two projects that focus on the inclusion of street children and victims of acid attacks to demonstrate their solidarity with those vulnerable groups in need of support . Finally , on April 29 the delegation will brief the journalists on the outcome of the visit at a press conference . """""""
6056,refugee,3,"IdeaRaya spokesman Maryam Ramli Lee in an interview with Malay Mail Online , September 10 , 2015 . For human rights , Idearaya is shining a spotlight on marginalised communities such as refugees and migrant workers , while its focus for philosophy this year would be on educating children to express themselves philosophically ."
2848,poor-families,4,Camfed would like to see this trend reversed . It would like to see more girls in school . Basic Education Statistics in Tanzania ( BEST 2010 ) show that only 18 percent of girls have completed secondary school education . This is why Camfed supports girls from poor families to obtain secondary education and its efforts have seen many go to university .
6995,immigrant,3,"Many celebrities wore blue ribbons to support the American Civil Liberties Union , which is seeking to shed light on the plight of young immigrants facing the potential of being deported ."
107,homeless,3,"""His present """" chambers """" may be quite humble , but Shiyani has the tiny space very neatly organized and clean . Many people pass him by but do not manage to see him , because the space is partially hidden behind trees , which gives him a relative privacy . """" There are many homeless sleeping around the station , """" Captain Xoli Mbele , from the nearby Johannesburg Central Police station said ."""
3661,poor-families,4,""""""" Some come from poor families and then you find swimming in millions and they lose focus , then they fizz out from football altogether , """" he said , making it clear that to have a Paul Pogba-esque success , one needs to work that much harder and not get influenced easily especially at this age and that too coming from Africa ."""
6309,hopeless,4,"Some years later the daughter 's marriage broke up . She had two children by then and needed money urgently . The father dipped into his savings and was eventually compelled to move into this home . His daughter has put in the papers for him to join her in Australia and he is hopeful of joining her soon . That day for him will be a joyful escape from the surrounding air of defeat , dejection and hopelessness ."
2610,immigrant,3,"""Nearly 15,000 West African teenagers leave their homes every year to play football in Europe . Few make good on their dreams . Some are lured by corrupt """" agents """" , smuggled across the searing Sahara and discarded in the streets of Europe , resigned to selling fake designer bags as undocumented immigrants . Others are nabbed by academies and feeder teams affiliated with European clubs and often dumped like bad stocks ."""
3213,immigrant,2,Hollywood star Leo Di Caprio urges help for reuniting immigrant children with their families
7726,refugee,4,"""In Dublin , the Church of Ireland Archbishop Dr Michael Jackson reflected on the year drawing to a close and recalled the """" horrific conflagration at the halting site in Carrickmines """" and the death of Garda Tony Golden in Omeath , as well as the """" refugees fleeing from Syria """" and other parts of the Middle East and the """" forgotten peoples of Africa """" ."""
5816,in-need,4,""""""" I have a lot of sympathy for folks who are in need in the city , """" Mr Edmonds-Waters said . """" This has become an extremely expensive city to live in . The divide between those who have and those who do n't is ridiculously ginormous . """""""
582,homeless,3,"It 's calculated that over 204,000 days of purpose-built residential accommodation to otherwise potentially homeless elderly men and women have been delivered by this personally driven altruistic act alone ."
3614,vulnerable,3,News this month that Anglican Care spent $4 million buying a Christchurch site as a hub for vulnerable youths is a fine example of that community-minded approach . In years to come there may be an interesting contrast between a beautifully restored cathedral that is empty much of the time and a youth hub and revamped City Mission that are constantly busy .
1870,vulnerable,3,"""He said : """" I think we can consider introducing a negligible telecom surcharge to be entirely borne by the initiator of a call . In order to protect the poor and vulnerable amongst us , we could structure it to only take effect after the third minute of talk ."""
9119,disabled,2,"NEW DELHI : Activists and medical professionals have lauded the government 's move to increase the ambit of the disabled list to offer benefits to acid attack survivors , those suffering from chronic neurological conditions , and haemophilia and sickle cell anaemia patients . This , they said , will help in integrating them into society ."
149,disabled,2,"Krueger recently harnessed that creativity to self-publish a book featuring the poems , artwork , photography and short stories of 16 ill or disabled artists from around the world . She hopes the book , which contains some of her own work as well , will show how talented disabled people can be ."
8979,poor-families,3,"The vast majority of girls and women caught in the exploitative global sex trade are not victims of kidnapping , like the Nigerian 276 abducted by Boko Haram , but rather of poverty . Human traffickers prey on poor families who do n't have access to education and are n't aware of their basic rights . Mired in grinding poverty , parents desperately take out loans on conditions they do n't understand , pledging their children on their debts ."
10253,hopeless,4,"Rather sad . Good set of pictures that tells a tale of survival , subsistence living , and hopeless nature of life in the tribal societies . Exploiting an unexpected geo-political bonanza is a temporary relief that is not sustainable . Education and economic development seem miles away ."
1922,hopeless,4,"The Global Gender Gap Report 2016 has ranked Pakistan 143 out of 144 countries . This really demonstrates the failure of feminists who are hopeless to break the historical shackles of bondage on women and establish favorable political , educational , economic , and health conditions ."
9925,immigrant,3,"THE jagged rocks , the stony beaches , the sweeping , heather covered hills ... the last views of the old country that faded from sight when a generation of immigrants set sail for the new world ( you can read that in Liam Neeson 's voice if you want ) ."
5612,homeless,4,"He said the victims who are currently rendered homeless can now be relieved of troubles as the 5,000 iron sheets from Mwanza had arrived , with 1,200 already distributed to victims in Bukoba Municipality ."
157,poor-families,4,"We are alarmed to learn of your recently circulated proposals that would eviscerate the Lifeline program and leave many of the most vulnerable people in the country without access to affordable communications . As you are well aware , the Lifeline program provides a modest monthly subsidy of $9.25 to connect low-income Americans to phone and internet services . As broadband prices continue to soar , and affordability continues to suffer , adoption gaps remain . The Lifeline program has proven critical for poor families and people of color who are caught on the wrong side of the digital divide ."
644,disabled,3,""""""" I and my daughter Monica are excited about providing a space for disabled people to be able to get together and earn fair prices for their work , """" Mr. Rogers said ."""
2918,migrant,3,Famously progressive San Francisco has among America 's most eco-friendly public policies and has declared itself a sanctuary to immigrants it considers persecuted by President Donald Trump 's administration .
8831,women,3,"It is also good news for women 's issues , which are in desperate need of a woman 's touch . As much work as the ANC has done thus far , we have a long way to go in this and in many other regards ."
7040,poor-families,3,"Michael Gove 's recent suggestion that inadequate financial management skills among poor families are to blame for the increasing demand on food banks has , unsurprisingly , sparked an angry response . Critics feel the Conservative Party is out of touch with the pressures on ordinary families ."
9282,poor-families,3,"For many poor families , the college is a very important institution providing their children with the education crucial to break the poverty cycle ."
1090,homeless,3,Mum living in homeless shelter has ' nowhere to bring boys on Christmas day ' <h> ' panicked '
7414,disabled,3,"Cheung said 20 disabled undergraduate students from seven universities will start their eight-week internship in government departments this month , receiving the same salaries as able-bodied colleagues of HK$9,600 a month ."
5367,poor-families,3,"However , this success story is not uncommon . It often happens that people from poor families have more perseverance to fight tooth an nail in business than children of rich parents who are used to get everything they want with ease . People without a strong spirit will quickly break down and drop out from the competition ."
8290,women,3,"In the space of a week , four beautiful young women gave up their lives voluntarily over reasons ranging from a love affair to depression to unemployment . All were educated and from reasonably good families . And these are just some of the reports that media covered . Looked at dispassionately and from a distance , none of their problems seem insurmountable . What a waste of young , beautiful lives !"
1648,women,3,"""Mari ? tte Coetzee from Stofberg Family Vineyards ( whose Mia Chenin Blanc 2016 was the garagiste trophy winner at last year 's Michelangelo Awards and the recipient of four Platter 's stars for the Mari ? tte Chenin Blanc 2016 ) , says : """" We can be extremely proud of the current women winemakers in our industry , especially considering most of them are juggling a family along with the long working hours ."""
151,poor-families,3,"10:41am - Parents of children who died must get compensation , free medicine must be provided to poor families across UP : Ram Gopal Yadav"
7651,poor-families,2,"But kids fall through the cracks . If they move around a lot between schools - as kids from poor families very often do , due to precarious housing - they can go years between check-ups ."
4156,poor-families,3,"The school authorities have taken the perfect procedure , not to obstruct studies . The 300 odd athletes who engage in sports are given the freedom to practice before and after school hours under the watchful eyes of the teachers who are in-charge of sports . The talented athletes who come from poor families are taken care of adequately with contributions from parents and well wishers ."
7191,poor-families,3,""""""" Boarding schools should be for those coming from poor families who when admitted to boarding secondary schools would be assured of their meals provided by schools , """" she said ."""
8722,immigrant,3,"But if the Supreme Court gives a favorable decision for the president , his immigration program would immediately take effect , changing the lives of eligible Filipino families and other immigrants ."
2351,homeless,3,"""She remembers how hard being homeless hit her . She remembers , too , how she would try and act as mad as possible to intimidate people and stop them from coming close to her . She would turn as she walked and make loud noises so that people would leave her alone . How did she manage not to lose sight of her future while she was struggling for survival ? """" I handled my situation of being homeless pretty easily , """" she says with a bit of distance . """" I had football to focus on . I wanted to represent my country and I was n't going to let anything get in the way . """""""
5722,hopeless,4,"""Calling for an immediate political solution to resolve the crisis in Syria , Erdogan said : """" Turkey 's incursion into northern Syria in early September had led to establishing peace , balance and stability in a region taken over by hopelessness """" ."""
1693,hopeless,4,""""""" They have made them to become hopeless and now , in """" going to God """" , they have ended up being deceived further and their situation is exploited and the society becomes even worse ."""
10099,vulnerable,2,"After a tragic event during his previous life as an FBI agent , Sawyer lost half a leg and developed an aversion to guns . So instead of the usual muscle-bound , wise-cracking , gun-toting cliche he 's often played , here he 's a vulnerable , disabled family man caught up in a twisted extortion plot ."
2342,migrant,4,"The measures have kept the migrants living in limbo . The overwhelming majority have not been granted asylum and they lead a tenuous existence , often at the whims of the government ."
4227,women,3,"We have done a great deal of work but the biggest thing we have done is to make the ministry a powerful tool for the protection of women ... Over the last four years , every time somebody comes up with a good idea or proposes an area in which women need help , we have adopted it immediately . We have been doing two things -- policymaking , which also pushes other ministries , and looking at individual cases of suffering . For me , both components are equally important ."
952,homeless,4,"Bombarded by schizophrenia , addiction and homelessness , you might say that Eoghan O'Driscoll has been to hell and back . But he is finding a new balance through painting . Interview : Michael Lanigan"
1063,hopeless,4,""""""" So many of us see the state of our home as some kind of reflection of our self-worth ( even though it 's not ! ) , and a mess can so easily make you feel like a failure . And for those who have mental illnesses , chronic illness , chronic pain , or disabilities , this can be even worse , because when you 're not physically able to do a whole-house clean , it can all seem a little hopeless . """""""
7111,vulnerable,4,"""Emmanuelle Riva in """" Amour , """" as a woman in her 80s whose mind and body deteriorate after a series of strokes , is even frailer , more vulnerable , and quite defenseless . The first time we saw Riva , in """" Hiroshima Mon Amour , """" we were struck by her sensual , yet patrician face . Now the sensuality is gone , but the dignity of that countenance remains ."""
9788,women,4,TurkIt 's heartening to see that measures are being taken in Khyber Pakhtunkhwa ( KP ) to empower women and give them work opportunities . You ! takes a look ...
5059,disabled,3,"New Zealand has been getting more comfortable confronting difficult issues in primetime . Last year , Nigel Latta : The Hard Stuff 's exploration of suicide and teenagers ' online lives was a hit . Earlier this year another season of The Undateables , a British show about dating amongst the disabled and those with learning disabilities played at 8.45pm Mondays on TVNZ 2 . And despite the exploitative name , Embarassing Bodies has helped open eyes and minds to the reality of those whose physical form deviates from a societal conception of ' normal ' ."
8624,poor-families,3,"""I am shocked , disgusted and dismayed at yet another police incident that is being mishandled . How many poor families have had their loved ones senselessly perish at the hands of highly paid , supposedly """" professional """" police officers and have had to fight against an unjust system that allows these officers to literally get away with murder unpunished. ?"""
7913,homeless,2,Charity plans to forgo parking so homeless can have gym and medical centre
5846,poor-families,4,"KOLKATA : Sourav Kaibartya , a fisherman 's son who scored 94.2% in his higher secondary examination this year got entry into NIT Durgapur for engineering course . The boy was at a loss as to who will fund his education . That is when a corporate house came into his rescue . Thirty-seven students like him from West Bengal meritorious but from poor families will now get to continue their studies with an initiative from Magma Fincorp Ltd ."
3672,homeless,3,"Yes , DMC you are very good at adding numbers , I am sure the dead and homeless are really thankful that you have the numbers . But as a government department I do not see any action in preventing , educating , keeping sos supply depots , or indeed any action , apart from the armed forces providing aid and the common man ."
5955,hopeless,4,"The indigenous Palestinians see themselves abandoned by the powerful nations of the UN . In sheer hopelessness and a sense of dehumization they are , regrettably , now resorting to nihilistic activities trying to harm Israeli Jews and getting killed every day by the trigger happy Israelis - civilians and security forces alike . It is a sad development in a region that has cried for justice for too long -- almost 70 years - only to be ignored and severely punished for their noncompliance to the Zionist dream of Eretz Israel ."
4393,disabled,3,The law stipulated 21 rights of the disabled persons . The disabled persons must get the national identity cards and be listed in the voters roll . Even they will be able to contest in the polls .
2956,in-need,2,"Over the past five years , the company has donated approximately 60,000 pounds of fresh produce for weekly outreach programs and via larger holiday events and Veteran ? s programs that have impacted tens of thousands of New Yorkers in need . Through Easter Seals of New York , Bloom Fresh delivers fresh fruits and vegetables each week to the Bronx Child Development Center to not only provide more healthy nutrients to children during lunch , but also for the children to take home to their families ."
9407,poor-families,3,"""Winfrey 's school is an attempt to wield philanthropy and celebrity against South Africa 's social and educational crises . High-achieving students from poor families were admitted after a rigorous application process in which Winfrey was deeply involved , and she has visited regularly to counsel her girls . She held a last , late-night """" pajama party """" with the graduates Friday ."""
6546,vulnerable,3,"ICCCAD remains a strong advocate of local initiatives and supports the concept of Community Based Adaptation ( CBA ) . Solutions developed at the local level have the best chance of being successful since it is the poorest living in areas prone to storms , floods , and droughts who are most vulnerable and best understand what needs to be done . This approach seeks to give these communities a voice since it is powerlessness as much as location that makes these communities vulnerable to climate change ."
9094,vulnerable,3,' The problem with this place is that there is a lot of vulnerable people here and they get the wrong kind of help .
4327,women,3,"If in addition ' miracles ' can be orchestrated then the acceptance and reverence become total . In a country where statistics state that unemployment is about 25 per cent but we know it is more like 70 per cent , where the next meal will come from is unpredictable and on a daily basis time just passes by ; it is not far-fetched for women to become prayer warriors for their children , husbands and siblings and are made to blame whatever is happening not on policies of the government but on the machinations of the devil ."
